{
  "schema_version": "1.0.0",
  "feature_id": "claims-ledger-and-normative-boundaries",
  "validation_id": "VAL-READY-016",
  "version": "1.0.0",
  "status_values": [
    "proposed",
    "in-review",
    "supported",
    "contradicted",
    "blocked",
    "superseded"
  ],
  "architecture_source": {
    "path": "policy/architecture.json",
    "claim_pointers": [
      "/system/artifact",
      "/system/database",
      "/system/operational_surface",
      "/system/standards_surface",
      "/authoritative_data/source",
      "/authoritative_data/derived",
      "/invariants/0",
      "/invariants/1",
      "/invariants/2",
      "/invariants/3",
      "/invariants/4",
      "/invariants/5"
    ]
  },
  "evidence": [
    {
      "id": "EVID-ARCHITECTURE-001",
      "qualification": "primary",
      "path": "policy/architecture.json",
      "url": null,
      "publisher": "Testament maintainers",
      "title": "Testament machine-readable architecture",
      "version": "1.0.0",
      "publication_date": "2026-08-21",
      "accessed_at": "2026-08-22",
      "sha256": "b704e5e4437d75a6b6e6eecbc15a9b4ed3a17d9fa3ad5714ec358d51c7c5a24b",
      "claim_supported": "Records the approved research-foundation system shape, authoritative-data model, invariants, and service boundaries.",
      "accessibility": "public-repository",
      "tested_commit": null,
      "environment": "Machine-readable governance source; no execution."
    },
    {
      "id": "EVID-RFC-0003",
      "qualification": "primary",
      "path": "docs/rfcs/0003-raw-capture.md",
      "url": null,
      "publisher": "Testament maintainers",
      "title": "RFC-0003 Raw capture",
      "version": "0.1.0",
      "publication_date": "2026-08-21",
      "accessed_at": "2026-08-22",
      "sha256": "13134baa67ec1dedc26d71b94845c542e75d40f23c804d2bda5cbc8a67713428",
      "claim_supported": "Proposes exact accepted bytes, layered derived representations, bounded chunks, and parse-independent custody.",
      "accessibility": "public-repository",
      "tested_commit": "e145b081e5f2ffd4dff63410d394bbb062310e88",
      "environment": "Proposed normative draft; not accepted or certification-eligible."
    },
    {
      "id": "EVID-RFC-0004",
      "qualification": "primary",
      "path": "docs/rfcs/0004-evidence-graph.md",
      "url": null,
      "publisher": "Testament maintainers",
      "title": "RFC-0004 Provenance-preserving evidence graph",
      "version": "0.1.0",
      "publication_date": "2026-08-21",
      "accessed_at": "2026-08-22",
      "sha256": "03d8380e5ba8fa9cfabfad6e7539b68f112ae961f6db9feef42c374206bcbad2",
      "claim_supported": "Proposes immutable source-linked records and distinct observations, assertions, decisions, enforcement, and audit.",
      "accessibility": "public-repository",
      "tested_commit": "e145b081e5f2ffd4dff63410d394bbb062310e88",
      "environment": "Proposed normative draft; not accepted or certification-eligible."
    },
    {
      "id": "EVID-RFC-0006",
      "qualification": "primary",
      "path": "docs/rfcs/0006-findings.md",
      "url": null,
      "publisher": "Testament maintainers",
      "title": "RFC-0006 Findings",
      "version": "0.1.0",
      "publication_date": "2026-08-21",
      "accessed_at": "2026-08-22",
      "sha256": "87ab20a5d6b27cc3549385564c8c3820c77a8aebe612fefb681c5d764690b8b9",
      "claim_supported": "Proposes findings as untrusted assertions that cannot directly select or claim enforcement.",
      "accessibility": "public-repository",
      "tested_commit": "e145b081e5f2ffd4dff63410d394bbb062310e88",
      "environment": "Proposed normative draft; not accepted or certification-eligible."
    },
    {
      "id": "EVID-RFC-0007",
      "qualification": "primary",
      "path": "docs/rfcs/0007-analyzer-runs.md",
      "url": null,
      "publisher": "Testament maintainers",
      "title": "RFC-0007 Analyzer runs",
      "version": "0.1.0",
      "publication_date": "2026-08-21",
      "accessed_at": "2026-08-22",
      "sha256": "6d9f976f86a48b564d81bcbd9d7bf85aeee657861d712e623e97e475ac228018",
      "claim_supported": "Proposes immutable analyzer provenance, bounded execution, explicit sovereignty, and no silent fallback.",
      "accessibility": "public-repository",
      "tested_commit": "e145b081e5f2ffd4dff63410d394bbb062310e88",
      "environment": "Proposed normative draft; not accepted or certification-eligible."
    },
    {
      "id": "EVID-RFC-0009",
      "qualification": "primary",
      "path": "docs/rfcs/0009-policy-decisions.md",
      "url": null,
      "publisher": "Testament maintainers",
      "title": "RFC-0009 Policy decisions",
      "version": "0.1.0",
      "publication_date": "2026-08-21",
      "accessed_at": "2026-08-22",
      "sha256": "3ca9941882b54c2ef61849f39e9b779128b18e71378a25495dd0057c5684f9ae",
      "claim_supported": "Proposes ordinary denial and the narrowly qualified degraded allow-and-audit behavior.",
      "accessibility": "public-repository",
      "tested_commit": "e145b081e5f2ffd4dff63410d394bbb062310e88",
      "environment": "Proposed normative draft; not accepted or certification-eligible."
    },
    {
      "id": "EVID-THREAT-RESEARCH-001",
      "qualification": "primary",
      "path": "policy/threat-privacy-sovereignty.json",
      "url": null,
      "publisher": "Testament maintainers",
      "title": "Threat, privacy, sovereignty, and key-custody research",
      "version": "0.2.0",
      "publication_date": "2026-08-21",
      "accessed_at": "2026-08-22",
      "sha256": "71c02eb28a68a99adbf6e5a378391895d00db648570e97b0ae6df08e0635c3ca",
      "claim_supported": "Records in-review threats, controls, residual risks, trust boundaries, sovereignty profiles, and runtime limitations.",
      "accessibility": "public-repository",
      "tested_commit": "4ec9023219aff0a9a3c9c058af4f15138e362e78",
      "environment": "Informative research candidate awaiting independent review."
    },
    {
      "id": "EVID-PROTOTYPE-CLAIMS-001",
      "qualification": "reproducible",
      "path": "policy/prototype-claims.json",
      "url": null,
      "publisher": "Testament maintainers",
      "title": "Prototype claim-to-result ledger",
      "version": "2.0.0",
      "publication_date": "2026-08-22",
      "accessed_at": "2026-08-22",
      "sha256": "fccfdd73276ef47873a11eb15e9e3907279ef849ff5ad55c0a55e542f2fe3e63",
      "claim_supported": "Links each disposable prototype conclusion to its active result, observation, inference, uncertainty, limitation, pending reviewer, and superseded evidence where applicable.",
      "accessibility": "public-repository",
      "tested_commit": "347a6969ae8bda5e8514be9a474414b26010312a",
      "environment": "Harmless synthetic fixtures; pinned plan and local or PostgreSQL 17 prototype harnesses."
    },
    {
      "id": "EVID-PROTOTYPE-DECISION-V2-001",
      "qualification": "reproducible",
      "path": "docs/research/benchmarks/v2/decision-durability.json",
      "url": null,
      "publisher": "Testament maintainers",
      "title": "PostgreSQL backend-disconnect durability evidence",
      "version": "2.0.0",
      "publication_date": "2026-08-22",
      "accessed_at": "2026-08-22",
      "sha256": "6127ab8a15215e64de2f37283b11e17de763fb2847dd7908b31324b8651e5aab",
      "claim_supported": "Three PostgreSQL 17 samples terminate an exact active fault backend and verify automatic rollback from a fresh connection within unchanged resource budgets.",
      "accessibility": "public-repository",
      "tested_commit": "6d0eb1037e7acb33b72834908a74540b0474caa4",
      "environment": "Harmless synthetic rows; PostgreSQL 17.11 on declared port 5440 with fresh service lifecycle and container-cgroup accounting per sample."
    },
    {
      "id": "EVID-PROTOTYPE-REPRODUCTION-001",
      "qualification": "reproducible",
      "path": "docs/research/benchmarks/reproduction.json",
      "url": null,
      "publisher": "Testament maintainers",
      "title": "Clean-clone prototype reproduction report",
      "version": "1.0.0",
      "publication_date": "2026-08-22",
      "accessed_at": "2026-08-22",
      "sha256": "a275b0993c733032b11684fe64f5ab2673d558e7b1b5cb38e3e2f09460d3d59a",
      "claim_supported": "Preserves 27 passing clean-clone samples and exact comparisons for all nine precommitted prototype and benchmark pairs.",
      "accessibility": "public-repository",
      "tested_commit": "69109a20ad1045cd2432a71a9fa216ffdc676458",
      "environment": "Darwin arm64 host, Go 1.26.4, Python 3.14.7, PostgreSQL 17.11 where declared."
    }
  ],
  "claims": [
    {
      "id": "CLAIM-ARCH-APPLICATION-ARTIFACT",
      "category": "architecture-shaping",
      "source_path": "policy/architecture.json",
      "source_pointer": "/system/artifact",
      "claim": "one statically linked Go application with role-separated runtime modes",
      "observation": "The approved machine architecture records one artifact and role-separated runtime modes.",
      "inference": "Implementation and release plans should preserve one distributable while separating high-risk runtime credentials by role.",
      "evidence_ids": ["EVID-ARCHITECTURE-001"],
      "contradictory_evidence": [{"id": "CONTRA-ARCH-ARTIFACT-001", "evidence_id": null, "statement": "One artifact does not demonstrate that every role is safe to run with one identity.", "effect": "The role-separation qualification remains mandatory."}],
      "uncertainty": "No production build or role-isolation test exists during the research foundation.",
      "limitations": ["This is an approved design constraint, not release evidence for a built executable."],
      "owner": "Testament architecture maintainers",